{
  "$schema": "https://json-schema.org/draft/2020-12/schema",
  "$id": "https://github.com/wpdotmd/wp-md-vibe-index/blob/main/data/schema.json",
  "title": "vibe-code index record",
  "type": "object",
  "required": ["slug", "name", "moat", "moatTags", "verdict", "build", "upkeepHoursPerYear", "couldBuild", "stillMissing", "requirements"],
  "additionalProperties": true,
  "properties": {
    "slug": {
      "type": "string",
      "pattern": "^[a-z0-9]+(-[a-z0-9]+)*$",
      "description": "Must match the filename and the plugin's detail slug on wp.md."
    },
    "name": { "type": "string", "minLength": 1 },
    "moat": {
      "type": "integer", "minimum": 0, "maximum": 100,
      "description": "Share of the product that is NOT code you could commission."
    },
    "moatTags": {
      "type": "array", "minItems": 1, "maxItems": 4, "uniqueItems": true,
      "items": { "enum": ["data", "service", "ai", "network", "compliance", "updates", "support", "library"] }
    },
    "verdict": {
      "enum": ["yes", "kinda", "no", "never"],
      "description": "Derived from moat — do not hand-edit. 0-33 yes, 34-57 kinda, 58-74 no, 75+ never."
    },
    "build": {
      "enum": ["sitting", "weekend", "weekends", "months"],
      "description": "Time to a usable MVP with a current coding agent."
    },
    "upkeepHoursPerYear": { "type": "integer", "minimum": 0, "maximum": 400 },
    "couldBuild": { "type": "string", "minLength": 20 },
    "stillMissing": { "type": "string", "minLength": 20 },
    "requirements": {
      "type": "array", "minItems": 3, "maxItems": 8,
      "items": { "type": "string", "minLength": 10 }
    },
    "notes": { "type": ["string", "null"] },
    "reviewedOn": { "type": ["string", "null"], "pattern": "^\\d{4}-\\d{2}-\\d{2}$" },
    "derived": {
      "type": "object",
      "description": "Regenerated by `wp ptp vibe_export`. Edits here are overwritten.",
      "additionalProperties": true
    }
  }
}
