{
    "slug": "all-in-one-seo-pack",
    "name": "All in One SEO Pack",
    "moat": 55,
    "moatTags": [
        "ai",
        "network",
        "updates"
    ],
    "verdict": "kinda",
    "build": "weekend",
    "upkeepHoursPerYear": 22,
    "couldBuild": "The same well-trodden on-page SEO surface as every other SEO plugin.",
    "stillMissing": "Link Assistant and the AI generators need a service behind them; the schema catalogue needs someone tracking what Google still reads.",
    "requirements": [
        "The standard on-page SEO surface: meta, canonical, robots, sitemaps",
        "Schema types with per-post overrides",
        "Broken-link and redirect handling",
        "Local SEO fields with opening hours and multiple locations"
    ],
    "notes": null,
    "reviewedOn": "2026-08-08",
    "derived": {
        "priceLabel": "Pro from $50/yr",
        "priceYearly": 50,
        "liveSites": 281092,
        "codeShare": 45,
        "generatedOn": "2026-08-08",
        "source": "ptp_premium_items() — BuiltWith + Envato, see plugin README"
    }
}
